mysql> system cls;
mysql> use sameerday3;
Database changed
mysql> select * from emp;
+-------+--------+-----------+------+------------+---------+---------+--------+
| empno | ename  | job       | mgr  | hiredate   | sal     | comm    | deptno |
+-------+--------+-----------+------+------------+---------+---------+--------+
|  7369 | SMITH  | CLERK     | 7902 | 1980-12-17 |  800.00 |    NULL |     20 |
|  7499 | ALLEN  | SALESMAN  | 7698 | 1981-02-20 | 1600.00 |  300.00 |     30 |
|  7521 | WARD   | SALESMAN  | 7698 | 1981-02-22 | 1250.00 |  500.00 |     30 |
|  7566 | JONES  | MANAGER   | 7839 | 1981-04-02 | 2975.00 |    NULL |     20 |
|  7654 | MARTIN | SALESMAN  | 7698 | 1981-09-28 | 1250.00 | 1400.00 |     30 |
|  7698 | BLAKE  | MANAGER   | 7839 | 1981-05-01 | 2850.00 |    NULL |     30 |
|  7782 | CLARK  | MANAGER   | 7839 | 1981-06-09 | 2450.00 |    NULL |     10 |
|  7788 | SCOTT  | ANALYST   | 7566 | 1982-12-09 | 3000.00 |    NULL |     20 |
|  7839 | KING   | PRESIDENT | NULL | 1981-11-17 | 5000.00 |    NULL |     10 |
|  7844 | TURNER | SALESMAN  | 7698 | 1981-09-08 | 1500.00 |    0.00 |     30 |
|  7876 | ADAMS  | CLERK     | 7788 | 1983-01-12 | 1100.00 |    NULL |     20 |
|  7900 | JAMES  | CLERK     | 7698 | 1981-12-03 |  950.00 |    NULL |     30 |
|  7902 | FORD   | ANALYST   | 7566 | 1981-12-03 | 3000.00 |    NULL |     20 |
|  7934 | MILLER | CLERK     | 7782 | 1982-01-23 | 1300.00 |    NULL |     10 |
+-------+--------+-----------+------+------------+---------+---------+--------+
14 rows in set (0.01 sec)

mysql> update emp
    -> set sal =10000
    -> quit;
ERROR 1064 (42000): You have an error in your SQL syntax; check the manual that corresponds to your MySQL server version for the right syntax to use near 'quit' at line 3
mysql> show databases;
+--------------------+
| Database           |
+--------------------+
| assignment         |
| assignment_sql1    |
| cardinfo           |
| customer           |
| databasetechnology |
| db1                |
| dbms               |
| dbmsd3             |
| dept               |
| devansh            |
| emp                |
| information_schema |
| jadvance           |
| jdbc               |
| myschool           |
| mysql              |
| performance_schema |
| sakila             |
| sameerday3         |
| sameerday31        |
| self               |
| sky                |
| student3           |
| sumit              |
+--------------------+
24 rows in set (0.01 sec)

mysql> use sameerday31;
Database changed
mysql> select * from emp;
+-------+-------+---------+--------+--------+
| EMPNO | ENAME | SALARY  | CITY   | DEPTNO |
+-------+-------+---------+--------+--------+
| 1     | ADAMS | 1000.00 | MUMBAI |  10.00 |
| 2     | BLAKE | 2000.00 | DELHI  |  10.00 |
| 3     | ALLEN | 2500.00 | MUMBAI |  20.00 |
| 4     | KING  | 3000.00 | DELHI  |  25.00 |
| 5     | FORD  | 4000.00 | MUMBAI |  30.00 |
+-------+-------+---------+--------+--------+
5 rows in set (0.00 sec)

mysql> update emp
    -> set sal =10000;
ERROR 1054 (42S22): Unknown column 'sal' in 'field list'
mysql> update emp
    -> set sal =10000
    -> where empno =1;
ERROR 1054 (42S22): Unknown column 'sal' in 'field list'
mysql> update emp
    -> set salary =10000;
Query OK, 5 rows affected (0.01 sec)
Rows matched: 5  Changed: 5  Warnings: 0

mysql> update emp
    -> set salary =10000
    -> where empno =1;
Query OK, 0 rows affected (0.00 sec)
Rows matched: 1  Changed: 0  Warnings: 0

mysql> select * from emp;
+-------+-------+----------+--------+--------+
| EMPNO | ENAME | SALARY   | CITY   | DEPTNO |
+-------+-------+----------+--------+--------+
| 1     | ADAMS | 10000.00 | MUMBAI |  10.00 |
| 2     | BLAKE | 10000.00 | DELHI  |  10.00 |
| 3     | ALLEN | 10000.00 | MUMBAI |  20.00 |
| 4     | KING  | 10000.00 | DELHI  |  25.00 |
| 5     | FORD  | 10000.00 | MUMBAI |  30.00 |
+-------+-------+----------+--------+--------+
5 rows in set (0.00 sec)

mysql> create database sameerday32;
Query OK, 1 row affected (0.01 sec)

mysql> create table emp(
    ->     -> EMPNO VARCHAR(20),
    ->     -> ENAME VARCHAR(20),
    ->     -> SALARY DECIMAL(9,2),
    ->     -> CITY CHAR(10),
    ->     -> DEPTNO DECIMAL(4,2));
ERROR 1064 (42000): You have an error in your SQL syntax; check the manual that corresponds to your MySQL server version for the right syntax to use near '-> EMPNO VARCHAR(20),
    -> ENAME VARCHAR(20),
    -> SALARY DECIMAL(9,2),
    ' at line 2
mysql> use sameerday32;
Database changed
mysql> create table emp(
    ->     -> EMPNO VARCHAR(20),
    ->     -> ENAME VARCHAR(20),
    ->     -> SALARY DECIMAL(9,2),
    ->     -> CITY CHAR(10),
    ->     -> DEPTNO DECIMAL(4,2));
ERROR 1064 (42000): You have an error in your SQL syntax; check the manual that corresponds to your MySQL server version for the right syntax to use near '-> EMPNO VARCHAR(20),
    -> ENAME VARCHAR(20),
    -> SALARY DECIMAL(9,2),
    ' at line 2
mysql> system cls;
mysql> show databases;
+--------------------+
| Database           |
+--------------------+
| assignment         |
| assignment_sql1    |
| cardinfo           |
| customer           |
| databasetechnology |
| db1                |
| dbms               |
| dbmsd3             |
| dept               |
| devansh            |
| emp                |
| information_schema |
| jadvance           |
| jdbc               |
| myschool           |
| mysql              |
| performance_schema |
| sakila             |
| sameerday3         |
| sameerday31        |
| sameerday32        |
| self               |
| sky                |
| student3           |
| sumit              |
+--------------------+
25 rows in set (0.00 sec)

mysql> use sameerday32;
Database changed
mysql> create table emp(
    ->     -> EMPNO VARCHAR(20),
    ->     -> ENAME VARCHAR(20),
    ->     -> SALARY DECIMAL(9,2),
    ->     -> CITY CHAR(10),
    ->     -> CITY CHAR(10),
    -> quit;
ERROR 1064 (42000): You have an error in your SQL syntax; check the manual that corresponds to your MySQL server version for the right syntax to use near '-> EMPNO VARCHAR(20),
    -> ENAME VARCHAR(20),
    -> SALARY DECIMAL(9,2),
    ' at line 2
mysql> create table emp(
    ->     EMPNO VARCHAR(20),
    ->     ENAME VARCHAR(20),
    ->      SALARY DECIMAL(9,2),
    ->      CITY CHAR(10),
    ->     DEPTNO DECIMAL(4,2));
Query OK, 0 rows affected (0.02 sec)

mysql> INSERT INTO emp VALUES('1','ADAMS',1000,'MUMBAI',10),
    ->      ('2','BLAKE',2000,'DELHI',10),
    ->      ('3','ALLEN',2500,'MUMBAI',20),
    ->      ('4','KING',3000,'DELHI',25),
    ->      ('5','FORD',4000,'MUMBAI',30);
Query OK, 5 rows affected (0.00 sec)
Records: 5  Duplicates: 0  Warnings: 0

mysql> select * from emp;
+-------+-------+---------+--------+--------+
| EMPNO | ENAME | SALARY  | CITY   | DEPTNO |
+-------+-------+---------+--------+--------+
| 1     | ADAMS | 1000.00 | MUMBAI |  10.00 |
| 2     | BLAKE | 2000.00 | DELHI  |  10.00 |
| 3     | ALLEN | 2500.00 | MUMBAI |  20.00 |
| 4     | KING  | 3000.00 | DELHI  |  25.00 |
| 5     | FORD  | 4000.00 | MUMBAI |  30.00 |
+-------+-------+---------+--------+--------+
5 rows in set (0.00 sec)

mysql> update emp 
    -> set salary =10000
    -> where deptno =1;
Query OK, 0 rows affected (0.00 sec)
Rows matched: 0  Changed: 0  Warnings: 0

mysql> select * from emp;
+-------+-------+---------+--------+--------+
| EMPNO | ENAME | SALARY  | CITY   | DEPTNO |
+-------+-------+---------+--------+--------+
| 1     | ADAMS | 1000.00 | MUMBAI |  10.00 |
| 2     | BLAKE | 2000.00 | DELHI  |  10.00 |
| 3     | ALLEN | 2500.00 | MUMBAI |  20.00 |
| 4     | KING  | 3000.00 | DELHI  |  25.00 |
| 5     | FORD  | 4000.00 | MUMBAI |  30.00 |
+-------+-------+---------+--------+--------+
5 rows in set (0.00 sec)

mysql> update emp 
    -> set salary =10000, city = 'pune'
    -> where city = 'mumbai';
Query OK, 3 rows affected (0.00 sec)
Rows matched: 3  Changed: 3  Warnings: 0

mysql> select * from emp;
+-------+-------+----------+-------+--------+
| EMPNO | ENAME | SALARY   | CITY  | DEPTNO |
+-------+-------+----------+-------+--------+
| 1     | ADAMS | 10000.00 | pune  |  10.00 |
| 2     | BLAKE |  2000.00 | DELHI |  10.00 |
| 3     | ALLEN | 10000.00 | pune  |  20.00 |
| 4     | KING  |  3000.00 | DELHI |  25.00 |
| 5     | FORD  | 10000.00 | pune  |  30.00 |
+-------+-------+----------+-------+--------+
5 rows in set (0.00 sec)

mysql> delect from emp
    -> where empno =1;
ERROR 1064 (42000): You have an error in your SQL syntax; check the manual that corresponds to your MySQL server version for the right syntax to use near 'delect from emp
where empno =1' at line 1
mysql> delete from emp
    -> where empno =1;
Query OK, 1 row affected (0.01 sec)

mysql> select * from emp;
+-------+-------+----------+-------+--------+
| EMPNO | ENAME | SALARY   | CITY  | DEPTNO |
+-------+-------+----------+-------+--------+
| 2     | BLAKE |  2000.00 | DELHI |  10.00 |
| 3     | ALLEN | 10000.00 | pune  |  20.00 |
| 4     | KING  |  3000.00 | DELHI |  25.00 |
| 5     | FORD  | 10000.00 | pune  |  30.00 |
+-------+-------+----------+-------+--------+
4 rows in set (0.00 sec)

mysql> delete from emp
    -> where city = 'mumbai';
Query OK, 0 rows affected (0.00 sec)

mysql> select * from emp;
+-------+-------+----------+-------+--------+
| EMPNO | ENAME | SALARY   | CITY  | DEPTNO |
+-------+-------+----------+-------+--------+
| 2     | BLAKE |  2000.00 | DELHI |  10.00 |
| 3     | ALLEN | 10000.00 | pune  |  20.00 |
| 4     | KING  |  3000.00 | DELHI |  25.00 |
| 5     | FORD  | 10000.00 | pune  |  30.00 |
+-------+-------+----------+-------+--------+
4 rows in set (0.00 sec)

mysql> delete from emp
    -> where city = 'delhi';
Query OK, 2 rows affected (0.00 sec)

mysql> select * from emp;
+-------+-------+----------+------+--------+
| EMPNO | ENAME | SALARY   | CITY | DEPTNO |
+-------+-------+----------+------+--------+
| 3     | ALLEN | 10000.00 | pune |  20.00 |
| 5     | FORD  | 10000.00 | pune |  30.00 |
+-------+-------+----------+------+--------+
2 rows in set (0.00 sec)

mysql> Terminal close -- exit!
